{
  "schema_version": 1,
  "app_id": "11111111-1111-4111-8111-111111111111",
  "repository_url": "https://github.com/example/inventory.git",
  "branch": "release/stable",
  "deployment_type": "compose",
  "config_path": "deploy/compose.yaml",
  "build_context": ".",
  "volumes": [
    {"volume_id": "22222222-2222-4222-8222-222222222222", "target": "/data", "read_only": false}
  ]
}
